{
  "schema_version": 1,
  "research_date": "2026-08-11",
  "publisher": "JetBrains s.r.o.",
  "product_code": "TBA",
  "release_type": "release",
  "api_url": "https://data.services.jetbrains.com/products/releases?code=TBA&latest=true&type=release",
  "version_pattern": "^[0-9]+(\\.[0-9]+){2,3}$",
  "allowed_download_hosts": [
    "download.jetbrains.com",
    "download-cdn.jetbrains.com"
  ],
  "targets": {
    "linux": {
      "archive_format": "tar.gz",
      "destination_template": "{home}/.local/bin/jetbrains-toolbox",
      "path_directory_template": "{home}/.local/bin",
      "marker_template": "{home}/.local/bin/.jetbrains-toolbox.devkit-wulf.json",
      "root_directory_template": "jetbrains-toolbox-{version}",
      "executable_relative_path": "jetbrains-toolbox",
      "architectures": {
        "amd64": {"download_key": "linux"},
        "arm64": {"download_key": "linuxARM64"}
      }
    }
  }
}
